{
  "version": "v1.0.0",
  "event_type": "analysis.queued",
  "timestamp": "2026-10-03T00:30:01Z",
  "payload": {
    "analysis_id": "an-789xyz",
    "snapshot_id": "snap-a1b2c3d4",
    "status": "QUEUED",
    "http_status": 202,
    "estimated_seconds": 15,
    "retry_after_ms": 3000,
    "queue_position": 2
  }
}
