{
  "version": "v1.0.0",
  "event_type": "analysis.ready",
  "timestamp": "2026-10-03T00:30:16Z",
  "payload": {
    "analysis_id": "an-789xyz",
    "status": "READY",
    "model_version": "gpt-4o-2025-08-06",
    "prompt_version": "v1.2.0",
    "questions": [
      {
        "question_id": "q-001",
        "concept_name": "async-error-handling",
        "file_path": "src/auth/login.ts",
        "line_start": 12,
        "line_end": 19,
        "question_type": "situational",
        "question_text": "The `refreshToken()` call is now awaited and its failure throws an `AuthError`. What would happen if this function is called from a non-async context, and how would you handle the resulting unhandled promise rejection?",
        "rubric": {
          "max_score": 100,
          "criteria": [
            {
              "name": "identifies_promise_rejection",
              "weight": 30,
              "description": "Recognizes that calling an async function without await leads to an unhandled promise rejection"
            },
            {
              "name": "proposes_error_boundary",
              "weight": 40,
              "description": "Suggests wrapping the call in try-catch or using .catch() handler"
            },
            {
              "name": "mentions_global_handler",
              "weight": 30,
              "description": "Mentions process.on('unhandledRejection') or window.addEventListener('unhandledrejection')"
            }
          ]
        }
      },
      {
        "question_id": "q-002",
        "concept_name": "session-management",
        "file_path": "src/auth/session.ts",
        "line_start": 1,
        "line_end": 28,
        "question_type": "open-ended",
        "question_text": "You introduced a new `SessionManager` class. Explain the Single Responsibility Principle (SRP) trade-offs of having this class handle both session creation and session validation. Would you split it? Why or why not?",
        "rubric": {
          "max_score": 100,
          "criteria": [
            {
              "name": "defines_srp",
              "weight": 25,
              "description": "Correctly defines SRP"
            },
            {
              "name": "identifies_dual_responsibility",
              "weight": 35,
              "description": "Identifies that creation and validation are separate concerns"
            },
            {
              "name": "argues_tradeoff",
              "weight": 40,
              "description": "Makes a reasoned argument for or against splitting, with justification"
            }
          ]
        }
      }
    ]
  }
}
